{
  "format": "MAATAA_API_CONTRACT_PROPOSAL",
  "formatVersion": "1.0.0",
  "id": "tlps.spatial-preview",
  "version": "1.0.0-draft.1",
  "lifecycle": "DRAFT",
  "application": "@maataa-app/tlps-application",
  "route": {
    "pageId": "223",
    "path": "/mobile/223/3d-cad-previz"
  },
  "domainDecision": {
    "status": "DECIDED",
    "authoritativeWorkingLayout": "eventsspatial.spatial_layouts",
    "parentProject": "eventsspatial.spatial_projects",
    "exhibitionDeliverable": "eventsspatial.exhibition_layouts",
    "roles": {
      "eventsspatial.spatial_layouts": [
        "project-scoped generic spatial/CAD working layout",
        "owns canvas geometry, layout_data, working versions, and generic spatial authoring lifecycle"
      ],
      "eventsspatial.exhibition_layouts": [
        "venue/exhibition-specific deliverable",
        "owns venue_area, exhibition-specific layout_data, and review/approval/publication lifecycle"
      ]
    },
    "dualWrite": false,
    "spatialToExhibitionConversion": "EXPLICIT_LATER_WORKFLOW_ONLY",
    "newSchemaOrForeignKey": false,
    "decisionSource": "user decision in M3.3 conversation"
  },
  "sourceBindings": {
    "tableContracts": [
      {
        "id": "eventsspatial.spatial_projects",
        "source": "packages/domain-registry/data/table-contracts.json"
      },
      {
        "id": "eventsspatial.spatial_layouts",
        "source": "packages/domain-registry/data/table-contracts.json"
      },
      {
        "id": "eventsspatial.exhibition_layouts",
        "source": "packages/domain-registry/data/table-contracts.json",
        "usage": "role distinction only; not read or written by this route contract"
      }
    ],
    "editorSources": [
      "apps/tlps-application/src/spatialDraft.mjs",
      "packages/domain-primitives/src/CanvasSurface.tsx",
      "packages/domain-primitives/src/Model3D.ts",
      "packages/domain-primitives/src/math3d.ts"
    ],
    "flows": [
      "TLPS-FLOW-093",
      "TLPS-FLOW-095",
      "TLPS-FLOW-096"
    ],
    "flowSource": "packages/domain-registry/data/flow-registry.json",
    "flowEnforcementStatus": "CLIENT_FILTER_ONLY; not server authorization evidence",
    "flowLineageStatus": "Flows provide route/actor context but their canonical table bindings do not include spatial_projects or spatial_layouts; operation-to-table links below are this DRAFT's explicit proposal."
  },
  "security": {
    "actorRequired": true,
    "actorContract": "LOCAL_FIXTURE_ACTOR_ID; permissions and tenant keys are fixture values only",
    "tenantScope": {
      "source": "authenticated actor and resolved spatial project",
      "clientMayOverride": false,
      "requiredChecks": [
        "resolve the project within the authenticated actor's organisation and workspace",
        "scope every layout read/write to the resolved project's organisation_id and workspace_id",
        "preserve the composite spatial_project_id + workspace_id + organisation_id relation"
      ]
    },
    "enforcement": "LOCAL_FIXTURE_HOST_CHECKS; not real identity or production authorization",
    "permissions": [
      {
        "code": "spatial.layout.view",
        "status": "LOCAL_FIXTURE_PERMISSION; real Identity assignment and host enforcement unresolved"
      },
      {
        "code": "spatial.layout.create",
        "status": "LOCAL_FIXTURE_PERMISSION; real Identity assignment and host enforcement unresolved"
      },
      {
        "code": "spatial.layout.edit",
        "status": "LOCAL_FIXTURE_PERMISSION; real Identity assignment and host enforcement unresolved"
      }
    ],
    "excludedPermissions": [
      "spatial.layout.publish is outside this route's current save behavior",
      "spatial.snapshot.export is outside this API slice; current export is local and derived",
      "exhibition.layout.* actions belong to the separate exhibition workflow"
    ],
    "fixtureActors": {
      "identitySource": "fixture data",
      "browserRoleIsActor": false,
      "tenantKeysDerivedFromActor": true,
      "permissions": [
        "spatial.layout.view",
        "spatial.layout.create",
        "spatial.layout.edit"
      ],
      "realAuthentication": false
    }
  },
  "layoutDataContract": {
    "status": "MAATAA_AUTHORED_DRAFT_FROM_CURRENT_EDITOR_MODEL; LOCAL_CONFORMANCE_RULES_FROZEN",
    "schemaId": "tlps.spatial-layout-data.v1",
    "schema": {
      "$schema": "https://json-schema.org/draft/2020-12/schema",
      "type": "object",
      "required": [
        "schemaVersion",
        "canvas2d",
        "scene3d"
      ],
      "additionalProperties": false,
      "properties": {
        "schemaVersion": {
          "const": "tlps.spatial-layout-data/v1"
        },
        "canvas2d": {
          "type": "object",
          "required": [
            "coordinateSpace",
            "width",
            "height",
            "origin",
            "units",
            "items"
          ],
          "additionalProperties": false,
          "properties": {
            "coordinateSpace": {
              "const": "maataa-canvas-world-v1"
            },
            "width": {
              "const": 1200
            },
            "height": {
              "const": 760
            },
            "origin": {
              "const": "top-left; x increases right; y increases down"
            },
            "units": {
              "const": "canvas-world-units"
            },
            "items": {
              "type": "array",
              "maxItems": 1000,
              "items": {
                "type": "object",
                "required": [
                  "id",
                  "kind",
                  "x",
                  "y",
                  "width",
                  "height",
                  "title"
                ],
                "additionalProperties": false,
                "properties": {
                  "id": {
                    "type": "string",
                    "minLength": 1,
                    "maxLength": 128
                  },
                  "kind": {
                    "enum": [
                      "rectangle",
                      "note",
                      "ellipse"
                    ]
                  },
                  "x": {
                    "type": "number",
                    "minimum": 0,
                    "maximum": 1200
                  },
                  "y": {
                    "type": "number",
                    "minimum": 0,
                    "maximum": 760
                  },
                  "width": {
                    "type": "number",
                    "exclusiveMinimum": 0,
                    "maximum": 1200
                  },
                  "height": {
                    "type": "number",
                    "exclusiveMinimum": 0,
                    "maximum": 760
                  },
                  "title": {
                    "type": "string",
                    "maxLength": 500
                  },
                  "color": {
                    "type": "string",
                    "pattern": "^#[0-9a-fA-F]{3}([0-9a-fA-F]{3})?$"
                  }
                }
              }
            }
          }
        },
        "scene3d": {
          "type": "object",
          "required": [
            "coordinateUnits",
            "rotationUnit",
            "models"
          ],
          "additionalProperties": false,
          "properties": {
            "coordinateUnits": {
              "type": "string",
              "minLength": 1,
              "description": "Must equal the parent spatial_project.units value."
            },
            "rotationUnit": {
              "const": "radian"
            },
            "models": {
              "type": "array",
              "maxItems": 250,
              "items": {
                "type": "object",
                "required": [
                  "id",
                  "name",
                  "geometry",
                  "position",
                  "rotation",
                  "scale",
                  "material"
                ],
                "additionalProperties": false,
                "properties": {
                  "id": {
                    "type": "string",
                    "minLength": 1,
                    "maxLength": 128
                  },
                  "name": {
                    "type": "string",
                    "maxLength": 160
                  },
                  "geometry": {
                    "enum": [
                      "box",
                      "sphere",
                      "plane"
                    ]
                  },
                  "position": {
                    "type": "array",
                    "items": {
                      "type": "number",
                      "minimum": -10000,
                      "maximum": 10000
                    },
                    "minItems": 3,
                    "maxItems": 3
                  },
                  "rotation": {
                    "type": "array",
                    "items": {
                      "type": "number",
                      "minimum": -10000,
                      "maximum": 10000
                    },
                    "minItems": 3,
                    "maxItems": 3
                  },
                  "scale": {
                    "type": "array",
                    "items": {
                      "type": "number",
                      "minimum": 0.05,
                      "maximum": 100
                    },
                    "minItems": 3,
                    "maxItems": 3
                  },
                  "material": {
                    "type": "object",
                    "required": [
                      "color",
                      "opacity",
                      "unlit"
                    ],
                    "additionalProperties": false,
                    "properties": {